[
  {
    "company": {
      "fr": "OVVP Corp",
      "en": "OVVP Corp"
    },
    "role": {
      "fr": "Développeur full-stack",
      "en": "Full-Stack Developer"
    },
    "start": 2024,
    "end": null,
    "summary": {
      "fr": "Apps mobiles Flutter, web React/Next.js, backend Node.js et Python. Lead technique sur des projets multi-plateformes.",
      "en": "Flutter mobile apps, React/Next.js web, Node.js and Python backends. Technical lead on multi-platform projects."
    },
    "highlights": {
      "fr": [
        "Développement d’applications mobiles Flutter",
        "Développement d’applications web avec React et Next.js",
        "Architecture backend en Node.js et Python",
        "Lead technique sur des projets multi-plateformes complexes"
      ],
      "en": [
        "Flutter mobile application development",
        "Web application development with React/Next.js",
        "Backend architecture with Node.js/Python",
        "Technical lead on complex multi-platform projects"
      ]
    }
  },
  {
    "company": {
      "fr": "Indépendant",
      "en": "Independent"
    },
    "role": {
      "fr": "Développeur freelance",
      "en": "Freelance Developer"
    },
    "start": 2021,
    "end": null,
    "summary": {
      "fr": "Applications web et mobiles pour des clients variés, de l’architecture au déploiement.",
      "en": "Web and mobile applications for various clients, from architecture to deployment."
    },
    "highlights": {
      "fr": [
        "Applications web et mobiles pour des clients variés",
        "Projets pris en charge de bout en bout, de l’architecture au déploiement",
        "Collaboration avec les équipes produit et les designers",
        "Livraison d’applications prêtes pour la production et évolutives"
      ],
      "en": [
        "Web and mobile application development for various clients",
        "End-to-end project ownership from architecture to deployment",
        "Collaboration with product teams and designers",
        "Delivery of production-ready, scalable applications"
      ]
    }
  }
]
